Authors,Author(s) ID,Title,Year,Source title,Volume,Issue,Art. No.,Page start,Page end,Page count,Cited by,citescore2017,DOI,Link,Document Type,Access Type,Source,EID
"Görgen, K., Lynch, A.H., Marshall, A.G., Beringer, J.",8680999400;7102636922;15047026200;7006146499;,Impact of abrupt land cover changes by savanna fire on northern Australian climate,2006,Journal of Geophysical Research Atmospheres,111,19, D19106,,,,20,,10.1029/2005JD006860,https://www.scopus.com/inward/record.uri?eid=2-s2.0-34247484138&doi=10.1029%2f2005JD006860&partnerID=40&md5=d0b7d97a89bf82a02500ec90e3330ff5,Article,Open Access,Scopus,2-s2.0-34247484138
"Tkadlec, E., Zbořil, J., Losík, J., Gregor, P., Lisická, L.",6701468831;15059704400;12140330100;15059168500;15059010500;,Winter climate and plant productivity predict abundances of small herbivores in central Europe,2006,Climate Research,32,2,,99,108,,20,,10.3354/cr032099,https://www.scopus.com/inward/record.uri?eid=2-s2.0-33750886815&doi=10.3354%2fcr032099&partnerID=40&md5=c93c0d2ddcc6ddcdb9948d05201c3d9e,Article,Open Access,Scopus,2-s2.0-33750886815
"Grimm, A.M., Natori, A.A.",7006720957;16177918600;,Climate change and interannual variability of precipitation in South America,2006,Geophysical Research Letters,33,19, L19706,,,,20,,10.1029/2006GL026821,https://www.scopus.com/inward/record.uri?eid=2-s2.0-34047232672&doi=10.1029%2f2006GL026821&partnerID=40&md5=752e39985b36b48a508f5156f1170515,Article,Open Access,Scopus,2-s2.0-34047232672
"Zhao, H., Moore, G.W.K.",7404778968;16643212300;,Reduction in Himalayan snow accumulation and weakening of the trade winds over the Pacific since the 1840s,2006,Geophysical Research Letters,33,17, L17709,,,,20,,10.1029/2006GL027339,https://www.scopus.com/inward/record.uri?eid=2-s2.0-33845622401&doi=10.1029%2f2006GL027339&partnerID=40&md5=5840c4199f0d11e7f14dd961bf67467f,Article,Open Access,Scopus,2-s2.0-33845622401
"Li, Y., Liu, X., Chen, B.",15822643700;23061019000;7408607943;,Cloud type climatology over the Tibetan Plateau: A comparison of ISCCP and MODIS/TERRA measurements with surface observations,2006,Geophysical Research Letters,33,17, L17716,,,,20,,10.1029/2006GL026890,https://www.scopus.com/inward/record.uri?eid=2-s2.0-33845646295&doi=10.1029%2f2006GL026890&partnerID=40&md5=87eaeb4338f3a7c0c3a0fa98b35299c7,Article,Open Access,Scopus,2-s2.0-33845646295
"Ruti, P.M., Lucarini, V., Dell'Aquila, A., Calmanti, S., Speranza, A.",6603191095;9239400200;7004950022;9239400400;57121328600;,Does the subtropical jet catalyze the midlatitude atmospheric regimes?,2006,Geophysical Research Letters,33,6, L06814,,,,20,,10.1029/2005GL024620,https://www.scopus.com/inward/record.uri?eid=2-s2.0-33646452298&doi=10.1029%2f2005GL024620&partnerID=40&md5=88e1e6de4bb728b815f64a9285479d23,Article,Open Access,Scopus,2-s2.0-33646452298
"Liu, J., Curry, J.A.",57203367163;7202162685;,Variability of the tropical and subtropical ocean surface latent heat flux during 1989-2000,2006,Geophysical Research Letters,33,5, L05706,,,,20,,10.1029/2005GL024809,https://www.scopus.com/inward/record.uri?eid=2-s2.0-33646367161&doi=10.1029%2f2005GL024809&partnerID=40&md5=a57daf5e6ae9da9be2eb07309a77b2cf,Article,Open Access,Scopus,2-s2.0-33646367161
"Wang, S., McGrath, R., Semmler, T., Sweeney, C., Nolan, P.",12243470500;12243565900;6506286471;14065570000;56727589000;,The impact of the climate change on discharge of Suir River Catchment (Ireland) under different climate scenarios,2006,Natural Hazards and Earth System Science,6,3,,387,395,,20,,10.5194/nhess-6-387-2006,https://www.scopus.com/inward/record.uri?eid=2-s2.0-33747091903&doi=10.5194%2fnhess-6-387-2006&partnerID=40&md5=c8494d16023c7c71076d4e1763bc331b,Article,Open Access,Scopus,2-s2.0-33747091903
"Giertz, S., Diekkrüger, B., Jaeger, A., Schopp, M.",8987601700;6603781218;7102990982;8655658100;,An interdisciplinary scenario analysis to assess the water availability and water consumption in the Upper Ouémé catchment in Benin,2006,Advances in Geosciences,9,,,3,13,,20,,10.5194/adgeo-9-3-2006,https://www.scopus.com/inward/record.uri?eid=2-s2.0-33749261978&doi=10.5194%2fadgeo-9-3-2006&partnerID=40&md5=773c89bbe3759590e37e19425a5a4408,Article,Open Access,Scopus,2-s2.0-33749261978
"Strengbom, J., Englund, G., Ericson, L.",6602426995;7005223441;57197984623;,Experimental scale and precipitation modify effects of nitrogen addition on a plant pathogen,2006,Journal of Ecology,94,1,,227,233,,20,,10.1111/j.1365-2745.2005.01073.x,https://www.scopus.com/inward/record.uri?eid=2-s2.0-33645092127&doi=10.1111%2fj.1365-2745.2005.01073.x&partnerID=40&md5=320e3f39b40efd7f3e4a135e2914a230,Article,Open Access,Scopus,2-s2.0-33645092127
"Ghude, S.D., Jain, S.L., Arya, B.C., Kulkarni, P.S., Kumar, A., Ahmed, N.",6507979420;8541283400;9249141700;9249141800;57203774965;15519516200;,Temporal and spatial variability of surface ozone at Delhi and Antarctica,2006,International Journal of Climatology,26,15,,2227,2242,,19,,10.1002/joc.1367,https://www.scopus.com/inward/record.uri?eid=2-s2.0-33845510101&doi=10.1002%2fjoc.1367&partnerID=40&md5=4854321001038e8ac28361846faab72b,Article,Open Access,Scopus,2-s2.0-33845510101
"Andreoli, R.V., Kayano, M.T.",7003602972;7004108287;,Tropical Pacific and South Atlantic effects on rainfall variability over Northeast Brazil,2006,International Journal of Climatology,26,13,,1895,1912,,19,,10.1002/joc.1341,https://www.scopus.com/inward/record.uri?eid=2-s2.0-33751015754&doi=10.1002%2fjoc.1341&partnerID=40&md5=ea5aa025cca080a60fb2f3f6e95c4ccd,Article,Open Access,Scopus,2-s2.0-33751015754
"Peel, M.C., McMahon, T.A.",7005574002;7201475387;,Recent frequency component changes in interannual climate variability,2006,Geophysical Research Letters,33,16, L16810,,,,19,,10.1029/2006GL025670,https://www.scopus.com/inward/record.uri?eid=2-s2.0-33845639560&doi=10.1029%2f2006GL025670&partnerID=40&md5=3004ea02696fe352fa2b446a02aee52b,Article,Open Access,Scopus,2-s2.0-33845639560
"Saha, S.K., Rinke, A., Dethloff, K.",36242447900;6701832491;6701915334;,Future winter extreme temperature and precipitation events in the Arctic,2006,Geophysical Research Letters,33,15, L15818,,,,19,,10.1029/2006GL026451,https://www.scopus.com/inward/record.uri?eid=2-s2.0-33845609556&doi=10.1029%2f2006GL026451&partnerID=40&md5=882aa00e81f40dfd4276b0ad986dd19f,Article,Open Access,Scopus,2-s2.0-33845609556
"Hall, C.M., Aso, T., Tsutsumi, M., Höffner, J., Sigernes, F., Holdsworth, D.A.",34770964000;7102596798;7201754973;55907891100;6602180281;7102342671;,Neutral air temperatures at 90 km and 70°N and 78°N,2006,Journal of Geophysical Research Atmospheres,111,14, D14105,,,,19,,10.1029/2005JD006794,https://www.scopus.com/inward/record.uri?eid=2-s2.0-33846096286&doi=10.1029%2f2005JD006794&partnerID=40&md5=badb602d51e98c8e346280c77caa5466,Article,Open Access,Scopus,2-s2.0-33846096286
"Chen, X., Wang, X., Guo, J.",21734034300;57192624749;56074336000;,Seasonal variability of the sea surface salinity in the East China Sea during 1990-2002,2006,Journal of Geophysical Research: Oceans,111,5, C05008,,,,19,,10.1029/2005JC003078,https://www.scopus.com/inward/record.uri?eid=2-s2.0-33745857615&doi=10.1029%2f2005JC003078&partnerID=40&md5=61d7877a399a73399282f98b4305805f,Article,Open Access,Scopus,2-s2.0-33745857615
"Voldoire, A.",55885528600;,Quantifying the impact of future land-use changes against increases in GHG concentrations,2006,Geophysical Research Letters,33,4, L04701,,,,19,,10.1029/2005GL024354,https://www.scopus.com/inward/record.uri?eid=2-s2.0-33645648940&doi=10.1029%2f2005GL024354&partnerID=40&md5=12d16b62d087cff1a6b9a7b8bbcccd64,Article,Open Access,Scopus,2-s2.0-33645648940
"Dreyer, L.L., Esler, K.J., Zietsman, J.",7004481508;6603708025;24280884700;,Flowering phenology of South African Oxalis-possible indicator of climate change?,2006,South African Journal of Botany,72,1,,150,156,,19,,10.1016/j.sajb.2005.06.009,https://www.scopus.com/inward/record.uri?eid=2-s2.0-33745497002&doi=10.1016%2fj.sajb.2005.06.009&partnerID=40&md5=9f569672f662a1f818fb8ef077c05604,Article,Open Access,Scopus,2-s2.0-33745497002
"Gienapp, P., Visser, M.E.",8225615900;7102107086;,Possible fitness consequences of experimentally advanced laying dates in Great Tits: Differences between populations in different habitats,2006,Functional Ecology,20,1,,180,185,,19,,10.1111/j.1365-2435.2006.01079.x,https://www.scopus.com/inward/record.uri?eid=2-s2.0-33645221160&doi=10.1111%2fj.1365-2435.2006.01079.x&partnerID=40&md5=e0388dcbf1069edef560374496f5ce24,Article,Open Access,Scopus,2-s2.0-33645221160
"Tselioudis, G., Rossow, W.B.",6603422104;7004540083;,Climate feedback implied by observed radiation and precipitation changes with midlatitude storm strength and frequency,2006,Geophysical Research Letters,33,2, L02704,,,,19,,10.1029/2005GL024513,https://www.scopus.com/inward/record.uri?eid=2-s2.0-33644763282&doi=10.1029%2f2005GL024513&partnerID=40&md5=7a667792066421df172b768baa6813ef,Article,Open Access,Scopus,2-s2.0-33644763282
"Croxton, P.J., Sparks, T.H., Cade, M., Loxton, R.G.",6507899665;7004767718;15759252100;24540219400;,Trends and temperature effects in the arrival of spring migrants in Portland (United Kingdom) 1959-2005,2006,Acta Ornithologica,41,2,,103,111,,19,,10.3161/068.041.0206,https://www.scopus.com/inward/record.uri?eid=2-s2.0-33846850551&doi=10.3161%2f068.041.0206&partnerID=40&md5=290d46ed8201eec19d345003a645e368,Article,Open Access,Scopus,2-s2.0-33846850551
"Lee, E.-J., Yeh, S.-W., Jhun, J.-G., Moon, B.-K.",55522574300;7402085600;6602989128;7101878692;,Seasonal change in anomalous WNPSH associated with the strong East Asian summer monsoon,2006,Geophysical Research Letters,33,21, L21702,,,,18,,10.1029/2006GL027474,https://www.scopus.com/inward/record.uri?eid=2-s2.0-34248520437&doi=10.1029%2f2006GL027474&partnerID=40&md5=81740d162c924877713ae4d898b20bee,Article,Open Access,Scopus,2-s2.0-34248520437
"Casper, B.B., Forseth, I.N., Wait, D.A.",7003431145;6701463640;7003603365;,"A stage-based study of drought response in Cryptantha flava (Boraginaceae): Gas exchange, water use efficiency, and whole plant performance",2006,American Journal of Botany,93,7,,978,987,,18,,10.3732/ajb.93.7.978,https://www.scopus.com/inward/record.uri?eid=2-s2.0-33745982594&doi=10.3732%2fajb.93.7.978&partnerID=40&md5=164b70a1cf9df28e7e53f4e78cd7d590,Article,Open Access,Scopus,2-s2.0-33745982594
"Turk, J., Bauer, P.",7201527458;7203019014;,The International Precipitation Working Group and its role in the improvement of quantitative precipitation measurements,2006,Bulletin of the American Meteorological Society,87,5,,643,647,,18,,10.1175/BAMS-87-5-643,https://www.scopus.com/inward/record.uri?eid=2-s2.0-33744538125&doi=10.1175%2fBAMS-87-5-643&partnerID=40&md5=cae4796373491fe53108344a87af37af,Article,Open Access,Scopus,2-s2.0-33744538125
"Schubert, C.J., Durisch-Kaiser, E., Holzner, C.P., Klauser, L., Wehrli, B., Schmale, O., Greinert, J., McGinnis, D.F., De Batist, M., Kipfer, R.",57203068986;10042326700;16645906200;10041249100;7006511139;8762647100;6601938905;7006812905;56274170700;56264781700;,Methanotrophic microbial communities associated with bubble plumes above gas seeps in the Black Sea,2006,"Geochemistry, Geophysics, Geosystems",7,4, Q04002,,,,18,,10.1029/2005GC001049,https://www.scopus.com/inward/record.uri?eid=2-s2.0-71849083276&doi=10.1029%2f2005GC001049&partnerID=40&md5=b68b5a305b687cf667915bad64f6911f,Article,Open Access,Scopus,2-s2.0-71849083276
"Luo, Z., Stephens, G.L.",7401699520;7202899330;,An enhanced convection-wind-evaporation feedback in a superparameterization GCM (SP-GCM) depiction of the Asian summer monsoon,2006,Geophysical Research Letters,33,6, L06707,,,,18,,10.1029/2005GL025060,https://www.scopus.com/inward/record.uri?eid=2-s2.0-33646448029&doi=10.1029%2f2005GL025060&partnerID=40&md5=201970d304ee7e6c1bc50546e2f4bfb5,Article,Open Access,Scopus,2-s2.0-33646448029
"Covey, C., Gleckler, P.J., Phillips, T.J., Bader, D.C.",7003876983;6507460574;56985140700;7102450474;,Secular trends and climate drift in coupled ocean-atmosphere general circulation models,2006,Journal of Geophysical Research Atmospheres,111,3, D03107,,,,18,,10.1029/2005JD006009,https://www.scopus.com/inward/record.uri?eid=2-s2.0-33646244781&doi=10.1029%2f2005JD006009&partnerID=40&md5=f8a8ba37a7947e1c54fcb0a5c2dae3c7,Article,Open Access,Scopus,2-s2.0-33646244781
"Brandes, O.M., Kriwoken, L.",14071341300;14071725200;,"Changing perspectives — Changing paradigms: Taking the ""Soft Path"" to water sustainability in the okanagan basin",2006,Canadian Water Resources Journal,31,2,,75,90,,18,,10.4296/cwrj3102075,https://www.scopus.com/inward/record.uri?eid=2-s2.0-33747471095&doi=10.4296%2fcwrj3102075&partnerID=40&md5=89e8a4a20d0d064458b26a8caa462b7e,Article,Open Access,Scopus,2-s2.0-33747471095
"Koster, R.D., Fekete, B.M., Huffman, G.J., Stackhouse Jr., P.W.",35495189300;7006319021;7101600167;6602844274;,"Revisiting a hydrological analysis framework with International Satellite Land Surface Climatology Project Initiative 2 rainfall, net radiation, and runoff fields",2006,Journal of Geophysical Research Atmospheres,111,22, D22S05,,,,17,,10.1029/2006JD007182,https://www.scopus.com/inward/record.uri?eid=2-s2.0-34548580216&doi=10.1029%2f2006JD007182&partnerID=40&md5=b6a4e87f3f7ed9880636784ab8074b22,Article,Open Access,Scopus,2-s2.0-34548580216
"Bond, N.A., Harrison, D.E.",7007160862;26430935600;,ENSO's effect on Alaska during opposite phases of the Arctic Oscillation,2006,International Journal of Climatology,26,13,,1821,1841,,17,,10.1002/joc.1339,https://www.scopus.com/inward/record.uri?eid=2-s2.0-33751017395&doi=10.1002%2fjoc.1339&partnerID=40&md5=d43324d0acf693edb22f3630d2d72822,Article,Open Access,Scopus,2-s2.0-33751017395
"Toole, J., Krishfield, R., Proshutinsky, A., Ashjian, C., Doherty, K., Frye, D., Hammar, T., Kemp, J., Peters, D., Timmermans, M.-L., von der Heydt, K., Packard, G., Shanahan, T.",7102330037;6602623905;6603573706;6603665524;7006919521;7006220541;7004911218;56789558600;16436842100;7003736022;6603905930;15059445400;36747031000;,Ice-tethered profilers sample the upper Arctic ocean,2006,Eos,87,41,,,,,17,,10.1029/2006EO410003,https://www.scopus.com/inward/record.uri?eid=2-s2.0-33750863229&doi=10.1029%2f2006EO410003&partnerID=40&md5=8106ef53f5d3eacbfcd7aaee14ad5295,Article,Open Access,Scopus,2-s2.0-33750863229
"Xiao, W., Yu, Q., Flerchinger, G.N., Zheng, Y.",49664368800;35236029000;7004242054;7404837587;,"Evaluation of SHAW model in simulating energy balance, leaf temperature, and micrometeorological variables within a maize canopy",2006,Agronomy Journal,98,3,,722,729,,17,,10.2134/agronj2005.0126,https://www.scopus.com/inward/record.uri?eid=2-s2.0-33646786385&doi=10.2134%2fagronj2005.0126&partnerID=40&md5=8664d3e98fd8484ac406b2bf38f93305,Article,Open Access,Scopus,2-s2.0-33646786385
"Teng, H., Buja, L.E., Meehl, G.A.",55259660400;9845516300;7006518289;,Twenty-first-century climate change commitment from a multi-model ensemble,2006,Geophysical Research Letters,33,7, L07706,,,,17,,10.1029/2005GL024766,https://www.scopus.com/inward/record.uri?eid=2-s2.0-33646829485&doi=10.1029%2f2005GL024766&partnerID=40&md5=5945cc9a7099c02ee1fe42e89fd08b93,Article,Open Access,Scopus,2-s2.0-33646829485
"Zaiki, M., Können, G.P., Tsukahara, T., Jones, P.D., Mikami, T., Matsumoto, K.",6508140033;6701700126;35148378000;55768583400;7401768193;55471218000;,Recovery of nineteenth-century Tokyo/Osaka meteorological data in Japan,2006,International Journal of Climatology,26,3,,399,423,,17,,10.1002/joc.1253,https://www.scopus.com/inward/record.uri?eid=2-s2.0-33644819802&doi=10.1002%2fjoc.1253&partnerID=40&md5=eee2ff7785cc8240dd4821ffd0e59eeb,Article,Open Access,Scopus,2-s2.0-33644819802
"Díaz-Maroto, I.J., Fernández-Parajes, J., Vila-Lameiro, P.",8943246700;11939878300;8943246600;,Autecology of rebollo oak (Quercus pyrenaica Willd.) in Galicia (Spain) [Autécologie du chêne tauzin (Quercus pyrenaica Willd.) en Galice (Espagne)],2006,Annals of Forest Science,63,2,,157,167,,17,,10.1051/forest:2005108,https://www.scopus.com/inward/record.uri?eid=2-s2.0-33646565979&doi=10.1051%2fforest%3a2005108&partnerID=40&md5=f1e64ef83df344a46ca4a51657427805,Article,Open Access,Scopus,2-s2.0-33646565979
"Castellani, C., Altunbaş, Y.",56243324800;6602752683;,Factors controlling the temporal dynamics of egg production in the copepod Temora longicornis,2006,Marine Ecology Progress Series,308,,,143,153,,17,,10.3354/meps308143,https://www.scopus.com/inward/record.uri?eid=2-s2.0-33644988311&doi=10.3354%2fmeps308143&partnerID=40&md5=e441f29d14ed4332f40daa8866e30ea8,Article,Open Access,Scopus,2-s2.0-33644988311
"Schoof, J.T., Pryor, S.C.",8079327900;7006219023;,An evaluation of two GCMs: Simulation of North American teleconnection indices and synoptic phenomena,2006,International Journal of Climatology,26,2,,267,282,,17,,10.1002/joc.1242,https://www.scopus.com/inward/record.uri?eid=2-s2.0-32544446894&doi=10.1002%2fjoc.1242&partnerID=40&md5=86d536c8b9a30496d743c3742b02df60,Article,Open Access,Scopus,2-s2.0-32544446894
"Yasuda, T., Sakurai, K.",7402397262;12760970700;,Interdecadal variability of the sea surface height around Japan,2006,Geophysical Research Letters,33,1,,,,,17,,10.1029/2005GL024920,https://www.scopus.com/inward/record.uri?eid=2-s2.0-33644627820&doi=10.1029%2f2005GL024920&partnerID=40&md5=10dc5ec92e2fb0fd0c52aa4079ac6775,Article,Open Access,Scopus,2-s2.0-33644627820
"Caprio, J.M., Quamme, H.A.",7005792295;6701776912;,"Influence of weather on apricot, peach and sweet cherry production in the Okanagan Valley of British Columbia",2006,Canadian Journal of Plant Science,86,1,,259,267,,17,,10.4141/P05-032,https://www.scopus.com/inward/record.uri?eid=2-s2.0-33750503621&doi=10.4141%2fP05-032&partnerID=40&md5=a5db9148c158ec4d40287cb61faca5c3,Article,Open Access,Scopus,2-s2.0-33750503621
"Lukas, S., Lukas, T.",14060677000;55768598500;,"A glacial geological and geomorphological map of the far NW Highlands, Scotland. Part 1",2006,Journal of Maps,2,1,,43,55,,16,,10.4113/jom.2006.50,https://www.scopus.com/inward/record.uri?eid=2-s2.0-33845617808&doi=10.4113%2fjom.2006.50&partnerID=40&md5=9f3bec5a38bbba7f805cde758b9e9b34,Article,Open Access,Scopus,2-s2.0-33845617808
"Vancoppenolle, M., Fichefet, T., Bitz, C.M.",8925509300;7003941060;6602558284;,Modeling the salinity profile of undeformed Arctic sea ice,2006,Geophysical Research Letters,33,21, L21501,,,,16,,10.1029/2006GL028342,https://www.scopus.com/inward/record.uri?eid=2-s2.0-34248513498&doi=10.1029%2f2006GL028342&partnerID=40&md5=e075065fda6ef577d9f9e8e45218e0dd,Article,Open Access,Scopus,2-s2.0-34248513498
"Weese, S.R., Bryan, F.O.",16178426100;7005524881;,Climate impacts of systematic errors in the simulation of the path of the North Atlantic Current,2006,Geophysical Research Letters,33,19, L19708,,,,16,,10.1029/2006GL027669,https://www.scopus.com/inward/record.uri?eid=2-s2.0-34047236977&doi=10.1029%2f2006GL027669&partnerID=40&md5=fe28cc33d4a71a2e9215bb3f213c2807,Article,Open Access,Scopus,2-s2.0-34047236977
"Burls, N.J., Reason, C.J.C.",8920681600;7006235116;,Sea surface temperature fronts in the midlatitude South Atlantic revealed by using microwave satellite data,2006,Journal of Geophysical Research: Oceans,111,8, C08001,,,,16,,10.1029/2005JC003133,https://www.scopus.com/inward/record.uri?eid=2-s2.0-33847328398&doi=10.1029%2f2005JC003133&partnerID=40&md5=604a0eed0a2e4352b20a1627b7286951,Article,Open Access,Scopus,2-s2.0-33847328398
"Dukhovskoy, D., Johnson, M., Proshutinsky, A.",6507280720;55574222934;6603573706;,"Arctic decadal variability from an idealized atmosphere-ice-ocean model: 1. Model description, calibration, and validation",2006,Journal of Geophysical Research: Oceans,111,6, C06028,,,,16,,10.1029/2004JC002821,https://www.scopus.com/inward/record.uri?eid=2-s2.0-33751076795&doi=10.1029%2f2004JC002821&partnerID=40&md5=0dc6524f35e78954b0ad7b0d479e3dd1,Article,Open Access,Scopus,2-s2.0-33751076795
"Gilles, D., Christian, W., Nicole, M., Lucien, H., Laurent, P.",6603145284;13406459400;13406165000;36554432200;13406736400;,Topography and recent winter rainfall regime change in temperate western European areas: A case study in the Rhine-Meuse basin,2006,International Journal of Climatology,26,6,,785,796,,16,,10.1002/joc.1285,https://www.scopus.com/inward/record.uri?eid=2-s2.0-33646450123&doi=10.1002%2fjoc.1285&partnerID=40&md5=ae881dd19c6d9cfb361aedc7659abc2e,Article,Open Access,Scopus,2-s2.0-33646450123
"Wen, J., Zhao, Y., Wexler, A.S.",36853899300;57203236671;7005728145;,"Marine particle nucleation: Observation at Bodega Bay, California",2006,Journal of Geophysical Research Atmospheres,111,8, D08207,,,,16,,10.1029/2005JD006210,https://www.scopus.com/inward/record.uri?eid=2-s2.0-33745257613&doi=10.1029%2f2005JD006210&partnerID=40&md5=62e9c3a76c609cac0c08f1c350ee9976,Article,Open Access,Scopus,2-s2.0-33745257613
"Pitman, A.J., Stouffer, R.J.",7005413744;7101632204;,Abrupt change in climate and climate models,2006,Hydrology and Earth System Sciences,10,6,,903,912,,16,,10.5194/hess-10-903-2006,https://www.scopus.com/inward/record.uri?eid=2-s2.0-33751514243&doi=10.5194%2fhess-10-903-2006&partnerID=40&md5=b23e328cb301d1431ddaadceb4ee2c27,Article,Open Access,Scopus,2-s2.0-33751514243
"Sparks, T.H., Huber, K., Dennis, R.L.H.",7004767718;22134762400;55507733300;,Complex phenological responses to climate warming trends? Lessons from history,2006,European Journal of Entomology,103,2,,379,386,,16,,10.14411/eje.2006.051,https://www.scopus.com/inward/record.uri?eid=2-s2.0-33744461027&doi=10.14411%2feje.2006.051&partnerID=40&md5=6151fe982f78dc2ce926f4c0c9536158,Article,Open Access,Scopus,2-s2.0-33744461027
"Cerrano, C., Totti, C., Sponga, F., Bavestrello, G.",7003839010;6603279322;6506709445;7006227646;,"Summer disease in Parazoanthus axinellae (Schmidt, 1862) (Cnidaria, Zoanthidea)",2006,Italian Journal of Zoology,73,4,,355,361,,15,,10.1080/11250000600911675,https://www.scopus.com/inward/record.uri?eid=2-s2.0-33750824009&doi=10.1080%2f11250000600911675&partnerID=40&md5=3cfc7dc5786365f538246870051649ff,Article,Open Access,Scopus,2-s2.0-33750824009
"Wood, K.R., Overland, J.E.",35178625800;7006961728;,Climate lessons from the first International Polar Year,2006,Bulletin of the American Meteorological Society,87,12,,1685,1697,,15,,10.1175/BAMS-87-12-1685,https://www.scopus.com/inward/record.uri?eid=2-s2.0-33846527290&doi=10.1175%2fBAMS-87-12-1685&partnerID=40&md5=f6334a523f3f0f0615bc264b12b06369,Article,Open Access,Scopus,2-s2.0-33846527290
"Tao, G., Yongfu, X., Yuhua, B., Xiao, Y.",9235255800;15756673200;15756657700;36793673200;,Synoptic characteristics of dust storms observed in Inner Mongolia and their influence on the downwind area (the Beijing-Tianjin Region),2006,Meteorological Applications,13,4,,393,403,,15,,10.1017/S1350482706002404,https://www.scopus.com/inward/record.uri?eid=2-s2.0-33845917218&doi=10.1017%2fS1350482706002404&partnerID=40&md5=c316848dc4df1894eff6f406882d5917,Article,Open Access,Scopus,2-s2.0-33845917218
"Bozec, A., Bouruet-Aubertot, P., Béranger, K., Crépon, M.",15924851700;6602784796;7801496228;7003749832;,Mediterranean oceanic response to the interannual variability of a high-resolution atmospheric forcing: A focus on the Aegean Sea,2006,Journal of Geophysical Research: Oceans,111,11, C11013,,,,15,,10.1029/2005JC003427,https://www.scopus.com/inward/record.uri?eid=2-s2.0-34548560254&doi=10.1029%2f2005JC003427&partnerID=40&md5=543b301988e6f54dda34420b9f173c1d,Article,Open Access,Scopus,2-s2.0-34548560254
"Muscheler, R., Beer, J.",6602856875;7201990763;,Solar forced Dansgaard/Oeschger events?,2006,Geophysical Research Letters,33,20, L20706,,,,15,,10.1029/2006GL026779,https://www.scopus.com/inward/record.uri?eid=2-s2.0-33845610051&doi=10.1029%2f2006GL026779&partnerID=40&md5=48ba4f1a7ee13441c4697d4eaafde866,Article,Open Access,Scopus,2-s2.0-33845610051
"Takemura, T., Tsushima, Y., Yokohata, T., Nozawa, T., Nagashima, T., Nakajima, T.",7202079615;7007021059;10241462700;10240710000;24470422300;7404243086;,Time evolutions of various radiative forcings for the past 150 years estimated by a general circulation model,2006,Geophysical Research Letters,33,19, L19705,,,,15,,10.1029/2006GL026666,https://www.scopus.com/inward/record.uri?eid=2-s2.0-34047240596&doi=10.1029%2f2006GL026666&partnerID=40&md5=bd32d5903907db24884475f57eeef0d3,Article,Open Access,Scopus,2-s2.0-34047240596
"Sabbatani, S., Giuliani, R., Manfredi, R.",7006191415;16052968600;7101890204;,Combined pegylated interferon and ribavirin for the Management of chronic hepatitis C in a prison setting,2006,Brazilian Journal of Infectious Diseases,10,4,,274,278,,15,,10.1590/S1413-86702006000400012,https://www.scopus.com/inward/record.uri?eid=2-s2.0-33947434791&doi=10.1590%2fS1413-86702006000400012&partnerID=40&md5=b49db299f9c52e842c0ced0c4c72d616,Article,Open Access,Scopus,2-s2.0-33947434791
"Yasunaka, S., Hanawa, K.",6505890285;7007177595;,Interannual summer temperature variations over Japan and their relation to large-scale atmospheric circulation field,2006,Journal of the Meteorological Society of Japan,84,4,,641,652,,15,,10.2151/jmsj.84.641,https://www.scopus.com/inward/record.uri?eid=2-s2.0-33750318354&doi=10.2151%2fjmsj.84.641&partnerID=40&md5=ce29f0c546a106d0ede6dd537b4ed63a,Article,Open Access,Scopus,2-s2.0-33750318354
"Lescroël, A., Bost, C.-A.",9737859100;7004165590;,Recent decrease in gentoo penguin populations at Iles Kerguelen,2006,Antarctic Science,18,2,,171,174,,15,,10.1017/S0954102006000198,https://www.scopus.com/inward/record.uri?eid=2-s2.0-33744962362&doi=10.1017%2fS0954102006000198&partnerID=40&md5=634fa071a58986f949672d236312e722,Article,Open Access,Scopus,2-s2.0-33744962362
